Product Name,Price,Quantity Available,Specifications
Կոնքամանի կափարիչ դանդաղ իջնող (Նաև մանկական) FALA 75471,9900,2,Չափսեր` - 402-462x371x48 մմ․
Տրապ ներժից երկար 40սմ FALA 75375,17200,2,"Հեղեղատարի երկարություն` - 400 մմ., Հեղեղաջրերի լայնություն` - 70 մմ․, Եզրերի լայնություն` - 20 մմ․, Սիֆոնի բարձրություն` - 52 մմ․, Միացման չափս` - 50/40 մմ․"
Տրապ ներժից 50սմ FALA 75369,23000,2,"Հեղեղատարի երկարություն` - 500 մմ., Հեղեղաջրերի լայնություն` - 70 մմ․, Եզրերի լայնություն` - 20 մմ․, Սիֆոնի բարձրություն` - 52 մմ․, Միացման չափս` - 50/40 մմ․"
Տրապ ներժից երկար 80սմ FALA 75372,32000,2,Չափսեր` - 7*84*14 սմ․
Կոնքամանի կափարիչ դանդաղ իջնող FALA 75464,8500,2,Չափսեր` - 412-472x361x44 մմ․
Կոնքամանի կափարիչ FALA 75465,7650,2,Չափսեր` - 402-462x371x48 մմ․
Կոնքամանի կափարիչ դանդաղ իջնող (Նաև մանկական) FALA 75472,9200,1,Չափսեր` - 412-474x361x47 մմ․
Սիֆոնի գլխիկ նիկել FALA 75483,1300,3,
Սիֆոնի գլուխիկ նիկելից FALA 75487,4650,2,"Մանեկի չափս` - 1/4"""
Սիֆոնի գլխիկ լատունից FALA 75484,3990,2,"Մանեկի չափս` - 1/4"", Հումք` - լատունե"
Կոնքամանի կափարիչ դանդաղ իջնող FALA 75469,13800,1,Չափսեր` - 407-467x368x49 մմ․
Տրապ ներժից դուշեվոյ 40սմ FALA 75368,17950,2,"Հեղեղատարի երկարություն` - 400 մմ․, Հեղեղաջրերի լայնություն` - 70 մմ․, Եզրերի լայնություն` - 20 մմ․, Սիֆոնի բարձրություն` - 52 մմ․, Միացման չափս` - 50/40 մմ․"
Տրապ ներժից պտտվող սիֆոնով 50սմ FALA 75345,25600,1,"Հեղեղատարի երկարություն` - 500 մմ․, Հեղեղաջրերի լայնություն` - 70 մմ․, Եզրերի լայնություն` - 20 մմ․, Սիֆոնի բարձրություն` - 56 մմ․, Միացման չափս` - 50/40 մմ․"
ֆասկա հանող ZUBR 23791-36,3700,2,Տրամագիծ ունեցող խողովակների համար` - 4-36 մմ․
Գոֆռե ZUBR 51830-12,900,6,"Երկարություն` - 120 սմ․, Կոյուղու խողովակին միացման տրամագիծ` - 40 մմ․, Ջրահեռացման անցքի տրամագիծ` - 38 մմ․"
Կոնքամանի մուշտուկ գոֆռեով 90° ճկուն ANI-PLAST K712R,4500,2,
Կոնքամանի մուշտուկ գոֆռեով 90° ճկուն ANI-PLAST K719R,3600,3,
Ատվոդ ANI PLAST 110մմ-14 W1228,2500,2,
Ատվոդ 45մմ ANI PLAST M160,500,5,
Խողովակ պայկով PPR 32 ֆոլգա KALDO մետր 22205,1180,227.92,"Պատի հաստություն` - 4 մմ., Ներքին տրամագիծ` - 24 մմ․, Արտաքին տրամագիծ` - 32 մմ․"
Խողովակ պայկով PPR 25 ֆոլգա KALDO մետր 22201,800,720.52,"Պատի հաստություն` - 3,25 մմ․, Ներքին տրամագիծ` - 18,5 մմ․, Արտաքին տրամագիծ` - 25 մմ."
Խողովակ պայկայով PPR-20 ֆոլգա KALDO մետրով 22200,600,782.2,"Պատի հաստություն` - 3 մմ., Ներքին տրամագիծ` - 14 մմ., Արտաքին տրամագիծ` - 20 մմ․"
Խողովակ պայկայով PPR-25 KALDO մետր 22399,460,544.15,"Պատի հաստություն` - 3,5 մմ․, Ներքին տրամագիծ` - 18 մմ., Արտաքին տրամագիծ` - 25 մմ."
Խողովակ պայկայով PPR-20 KALDO մետր 22398,330,647.5,"Պատի հաստություն` - 2,8 մմ․, Ներքին տրամագիծ` - 14,4 մմ․, Արտաքին տրամագիծ` - 20 մմ․"
Խողովակ պայկայով PPR 32 KALDO մետր 22331,790,237,"Պատի հաստություն` - 5,4 մմ․, Ներքին տրամագիծ` - 21,2 մմ․, Արտաքին տրամագիծ` - 32 մմ․"
Խողովակ ջրի մետալոպալստի KALDO 2632 սառը 22277,830,243,"Չափսեր` - 4.3 PE-AL-PE Ø2632, Աշխատանքային ճնշում` - 10 բար, Աշխատանքային ջերմաստիճան` - 65 ºC, Միակցման եղանակ` - սեղմում / ձգում"
Խողովակ ջրի մետալոպալստի KALDO 1620 սառը 22278,370,77,"Չափսեր` - 4.1 PE-AL-PE Ø1620, Աշխատանքային ճնշում` - 10 բար, Աշխատանքային ջերմաստիճան` - 65 ºC, Միակցման եղանակ` - սեղմում / ձգում"
Կոնքամանի կափարիչի հեղույս РБМ СПУ-2,600,1,
Կոնքամանի կափարիչի հեղույս РБМ СПУ-1,500,4,
Կոնքամանի կափարիչ ամորտիզատրով СПУ-2А РБМ,4800,2,
Կոնքամանի կափարիչ СПУ-2 РБМ,3450,1,
Կոնքամանի կափարիչ СПУ-1 РБМ,3600,3,
Կոնքամանի պռագլատկա РБМ,800,3,
Կոնքամանի պռագլատկա РБМ,800,2,
Կոնքամանի պռագլատկա РБМ,800,3,
Կոնքամանի պռագլատկա РБМ,500,5,
Կոնքամանի պռագլատկա РБМ,800,3,
Կոնքամանի պռագլատկա РБМ М60,800,2,
Կոնքամանի պռագլատկա РБМ,800,2,
Կոնքամանի պռագլատկա РБМ,600,4,
Պապլավոկ կողքից РБМ,1500,2,
Պապլավոկ մեմբրանով РБМ,990,2,
Պապլավոկ գունավոր շարիկով РБМ,650,2,
"Կոնքամանի մեխանիզմ տակից АС-17,3М РБМ",4100,1,
"Կոնքամանի մեխանիզմ կողքից АС-16,3М РБМ",2700,3,
"Կոնքամանի մեխանիզմ տակից АС-12,1М РБМ",4200,3,
"Կոնքամանի մեխանիզմ կողքից АС-11,1М РБМ",4500,2,
"Կոնքամանի մեխանիզմ տակից АС-6,1М РБМ",2250,2,
"Կոնքամանի մեխանիզմ կողքից АС-5,1М РБМ",3600,3,"Լայնություն` - 20 սմ, Բարձրություն` - 35 սմ, Խորություն` - 8 սմ"
"Կոնքամանի մեխանիզմ կողքից АС-4,1М РБМ",2900,2,
"Կոնքամանի մեխանիզմ կողքից АС-1,1М РБМ",2400,2,
Կոնքամանի մեխանիզմ քաշովի АБ-118 РБМ,2000,2,
Սիֆոն 2 տեղ մեծ գլխ սլիվով ANI PLAST A3045,9900,2,
Սիֆոն 1 տեղ C5510 ANI PLAST,1700,5,
Վաննայի սիֆոն ANI PLAST C6055,2750,2,
Կոնքամանի մուշտուկ ANI PLAST W9228,3200,5,
Սիֆոն 1 տեղ ANI PLAST C1015,2700,6,Չափսեր` - 310*94*73 մմ.
Սիֆոն 1 տեղ ANI PLAST BM1010,2250,8,Չափսեր` - 170*415*70 մմ.
Պապլավոկ տակից ունիվերսալ ANI PLAST WC5513,2600,3,
Կոնքամանի քաշիչ ANI PLAST WC7040M,2500,5,Չափսեր` - 330*100*100 մմ.
Կոնքամանի էքսցենտիկ կոշտ ANI PLAST W0421,2050,4,Չափսեր` - 124*141*148 մմ.
Սիֆոն փոքր լվացքի մեքենայի համար ANI PLAST M500,2850,2,Չափսեր` - 105*95*85 մմ.
Ատվոդ ուղիղ ծայրը ռեզին ANI PLAST W1238,2800,2,
Կոնքամանի բաչոկի հեղույսի ռեզին ANI PLAST M010,60,29,
Կոնքամանի կափարիչ ANI PLAST WS0100,3650,2,
Կոնքամանի գոֆռե ANI PLAST K711R,4500,2,Չափսեր` - 250*142*142 մմ.
Պրագլատկա կոնաձև ANI PLAST M032,100,54,Չափսեր` - Ø 38х9 մմ.
Սիֆոն 2 տեղ ANI PLAST A3515,4200,1,Չափսեր` - 595x360x93 մմ.
Կոնքամանի պռագլատկա գուպկա ANI PLAST M075,670,9,Չափսեր` - 110*110*16 մմ.
Կոնքամանի գոֆռե ANI PLAST K928,2600,2,Չափսեր` - 260*142*142 մմ.
Կոնքամանի մեխամիզմ ANI PLAST WC3550M,3950,2,Չափսեր` - 290*80*50 մմ.
Կոնքամանի մեխանիզմ ANI PLAST WC3050M,4500,3,Չափսեր` - 231*135*51 մմ.
Պրագլատկա կոնաձև ANI PLAST M040,120,28,Չափսեր` - Ø 44.5х8 մմ.
Կոնքամանի մեխանիզմ կողքից 3/8 ANI PLAST WC3070M,5250,2,Չափսեր` - 230х128х51 մմ.
Սիֆոն պիսուարի հորիզոնական ANI PLAST U0605,7200,1,
Սիֆոն պիսուարի ուղղահայաց ANI PLAST U0705,7200,1,
Պրագլատկա երկկողմանի ANI PLAST M080,350,4,Չափսեր` - Ø 74х18 մմ.
Կոնքամանի մեխանիզմ ANI PLAST WC6550M,3500,4,Չափսեր` - 290*80*50 մմ.
Կոնքամանի մեխանիզմ ANI PLAST WC6050M,3450,5,Չափսեր` - 231*135*51 մմ.
Տրապ ուղիղ ունիվերսալ ANI PLAST TQ5612,6700,1,Չափսեր` - 145*180*148 մմ.
Տրապ ուղիղ ունիվերսալ ANI PLAST TQ1712,6800,2,Չափսեր` - 230*220*220 մմ.
Վաննայի սիֆոն տռոսով ANI PLAST EC255,7950,2,Չափսեր` - 565*705*81 մմ.
Պադոնի սիֆոն ANI PLAST E615,2550,3,Չափսեր` - 350*95*92 մմ.
Սիֆոն ANI PLAST A2015,2600,3,Չափսեր` - 245*183*86 մմ.
Պադոնի սիֆոն կալենա ANI PLAST E100,1200,3,Չափսեր` - 216*116*66 մմ.
Գոֆռե ANI PLAST K214,1450,3,Չափսեր` - 495*45*45
Սիֆոն 2 տեղ ANI PLAST A3545,17500,2,Չափսեր` - 595*680*115 մմ.
Տրապ ուղիղ ANI PLAST TA1210,2800,4,Չափսեր` - 150*150*148 մմ.
Տրապ թեք պլասմասե ANI PLAST TA1110,2250,4,Չափսեր` - 152*200*148 մմ.
Ատվոդ լվացքի մեքենայի տեղով ANI PLAST M110,850,3,Չափսեր` - 131*120*66 մմ.
Սիֆոն 2 տեղ ANI PLAST A3000,3500,3,Չափսեր` - 360*600*86 մմ.
Զուգարանակոնքի գոֆրե անցում ANI PLAST K728R,4150,2,Չափսեր` - 340*142*142 մմ.
Պռագլատկա ANI PLAST M022,130,28,Չափսեր` - Ø 45х2 մմ.
Պռագլատկա ANI PLAST M020,150,33,Չափսեր` - Ø 38х2 մմ
Սիֆոն գոֆռե ANI PLAST BM1315,2700,3,Չափսեր` - 220*480*70 մմ.
Սիֆոն 2 տեղ մեծ գլխով ANI PLAST A7500,16500,1,Չափսեր` - 520*400*92 մմ.
Սիֆոն գոֆռե ANI PLAST G217,2250,3,
Սիֆոն գոֆռե ANI PLAST G204,2000,4,Չափսեր` - 345*70*70 մմ.
Սիֆոն գոֆռե ANI PLAST G104,2200,3,Չափսեր` - 350*75*75 մմ.
Կոնքամանի քաշիչ ANI PLAST WC7030M,2500,4,Չափսեր` - 350*115*105 մմ.
Գոֆռե ANI PLAST K116,1350,7,Չափսեր` - 541*67*67 մմ.
Սիֆոն 2 տեղ սլիվով ANI PLAST A3500,4200,3,Չափսեր` - 400*600*86 մմ.
Կոնքամանի գոֆռե ANI PLAST K821R,3100,1,Չափսեր` - 200*133*133 մմ.
Կոնքամանի քաշիչ ANI PLAST WC7010C,5900,4,
Սիֆոն 1տեղ ANI PLAST A1115,2700,5,Չափսեր` - 440*305*230 մմ.
Պապլավոկ տակից ANI PLAST WC5550,1300,6,Չափսեր` - 290*80*50 մմ.
Պապլավոկ կողքից ANI PLAST WC5050,1200,6,Չափսեր` - 230*135*55 մմ.
Տրապ ուղիղ ANI PLAST TA5204,1900,4,Չափսեր` - 100*105*105 մմ.
Տրապ թեք ANI PLAST TA5104,800,3,Չափսեր` - 85*152*105 մմ.
Տրապ ուղիղ ANI PLAST TA5202,3100,2,Չափսեր` - 100*105*105 մմ.
Տրապ թեք ANI PLAST TA5102,2850,4,Չափսեր` - 85*152*105 մմ.
Տրապ թեք ANI PLAST TA5112,3990,2,Չափսեր` - 85*152*105 մմ.
Կոնքամանի մեխանիզմ ANI PLAST WC4550M,2850,2,Չափսեր` - 290*80*50 մմ.
Կոնքամանի մեխանիզմ ANI PLAST WC4050M,3850,2,Չափսեր` - 231*135*51 մմ.
Պապլավոկ տակից ANI PLAST WC5510,2550,3,Չափսեր` - 265*85*55 մմ.
Տրապ ուղիղ ANI PLAST TA5212,5300,6,Չափսեր` - 100*150*148 մմ.
Տրապ թեք ANI PLAST TA1112,4800,3,Չափսեր` - 152*200*148 մմ.
Կոնքամանի մուշտուկ 45° ANI PLAST W4220,2450,2,Չափսեր` - 144*221*142 մմ.
Կոնքամանի մուշտուկ 90° ANI PLAST W9220,2800,4,Չափսեր` - 144*221*142 մմ.
Ատվոդ ուղիղ ANI PLAST W1218,1750,3,Չափսեր` - 141*141*125 մմ
Ատվոդ 45° ANI PLAST W4228,2400,2,Չափսեր` - 145*179*141 մմ
Կոնքամանի էքսցենտրիկ մանժետ ANI PLAST W0410,1350,3,Չափսեր` - 124*141*168 մմ
Կոնքամանի էքսցենտրիկ կոշտ ANI PLAST W0220,1950,2,Չափսեր` - 124*141*168 մմ
Սիֆոնի գլխիկ մեծ ANI PLAST M250,4300,2,
Սիֆոնի գլխիկ ANI PLAST M200,1200,5,
Սիֆոնի գլխիկ ANI PLAST M100,1100,5,
Կոնքամանի գոֆռե ANI PLAST K828,1850,8,Չափսեր` - 225*133*133 մմ
Կոնքամանի գոֆռե ANI PLAST K821,2650,4,Չափսեր` - 200*133*133 մմ
Գոֆռե ANI PLAST K217,1900,4,Չափսեր` - 541*58*58 մմ
Գոֆռե ANI PLAST K205,850,4,Չափսեր` - 320*61*61 մմ
Գոֆռե ANI PLAST K203,930,3,Չափսեր` - 320*61*61
Գոֆրե ANI PLAST K115,1300,11,Չափսեր` - 495*67*67 մմ
Գոֆռե 40-80 ANI PLAST K106,900,3,Չափսեր` - 320*67*67 մմ
Սիֆոն գոֆրե ANI PLAST G716,1650,2,Չափսեր` - 571x75х75 մմ
Սիֆոն գոֆռե ANI PLAST G108,2100,7,Չափսեր` - 476*140*75
Սիֆոն գոֆռե ANI PLAST G115,2350,6,Չափսեր` - 525*75*75 մմ
Վաննայի սիֆոն ANI PLAST E050,4500,1,Չափսեր` - 74*260*128 մմ
Վաննայի սիֆոն ANI PLAST E255,4750,2,Չափսեր` - 234*115*74 մմ
Պադոնի սիֆոն ANI PLAST E010,1900,2,Չափսեր` - 106*66*227 մմ
Պադոնի սիֆոն ANI PLAST E015,2600,2,Չափսեր` - 106*66*227 մմ
Սիֆոն գոֆռե ANI PLAST BM1015,2500,5,Չափսեր` - 170*415*70 մմ
Սիֆոն 1 տեղ գոֆռե ANI PLAST A0115,2700,7,Չափսեր` - 270*110*86 մմ
Սիֆոն 1 տեղ գոֆռե ANI PLAST C0115,2900,8,Չափսեր` - 270*94*73 մմ․
Կոնքամանի դյուբել ZUBR 44211,550,13,"Տրամագիծ` - 8 մմ․, Գույն` - խռոմ"
Կոնքամանի դյուբել ZUBR 44210,470,8,"Տրամագիծ` - 8 մմ․, Գույն` - սպիտակ"
"Դյուբել՝ լվացարանի, հաստ, ZUBR 44216",1100,11,Հաստությունը` - 14 մմ․
Դյուբել լվացարանի ZUBR 44215,650,10,"Նախնական հորատման տրամագիծ` - 10 մմ., Դյուբելի չափսեր` - 10x50 մմ․"
